{
  "kind": "atd_cards",
  "season": 2026,
  "week": 7,
  "generated_utc": "2026-10-24T14:01:01Z",
  "pool_generated_utc": "2026-10-24T14:00:53Z",
  "adopted": true,
  "scope": "week",
  "pricing": "independent: one leg per game, product of pool model_prob",
  "modes": {
    "all_td": {
      "cards": {
        "2": [
          {
            "card_id": "4e9affa8fa2c5a8a",
            "mode": "all_td",
            "label": "ALL ANYTIME TD",
            "n_legs": 2,
            "legs": [
              {
                "market": "anytime_td",
                "selection": "P. Nacua anytime TD",
                "model_prob": 0.6393,
                "line": 0.5,
                "player": "Puka Nacua",
                "team": "LAR",
                "position": "WR",
                "gsis_id": "espn-4426515",
                "game_id": "401873021",
                "side": "away"
              },
              {
                "market": "anytime_td",
                "selection": "J. Gibbs anytime TD",
                "model_prob": 0.6353,
                "line": 0.5,
                "player": "Jahmyr Gibbs",
                "team": "DET",
                "position": "RB",
                "gsis_id": "espn-4429795",
                "game_id": "401873020",
                "side": "home"
              }
            ],
            "model_prob": 0.40614729,
            "break_even_american": 146,
            "n_atd": 2
          },
          {
            "card_id": "36c8916afa35719d",
            "mode": "all_td",
            "label": "ALL ANYTIME TD",
            "n_legs": 2,
            "legs": [
              {
                "market": "anytime_td",
                "selection": "P. Nacua anytime TD",
                "model_prob": 0.6393,
                "line": 0.5,
                "player": "Puka Nacua",
                "team": "LAR",
                "position": "WR",
                "gsis_id": "espn-4426515",
                "game_id": "401873021",
                "side": "away"
              },
              {
                "market": "anytime_td",
                "selection": "B. Robinson anytime TD",
                "model_prob": 0.6336,
                "line": 0.5,
                "player": "Bijan Robinson",
                "team": "ATL",
                "position": "RB",
                "gsis_id": "espn-4430807",
                "game_id": "401873017",
                "side": "home"
              }
            ],
            "model_prob": 0.40506048,
            "break_even_american": 147,
            "n_atd": 2
          },
          {
            "card_id": "79086d77743d2775",
            "mode": "all_td",
            "label": "ALL ANYTIME TD",
            "n_legs": 2,
            "legs": [
              {
                "market": "anytime_td",
                "selection": "J. Gibbs anytime TD",
                "model_prob": 0.6353,
                "line": 0.5,
                "player": "Jahmyr Gibbs",
                "team": "DET",
                "position": "RB",
                "gsis_id": "espn-4429795",
                "game_id": "401873020",
                "side": "home"
              },
              {
                "market": "anytime_td",
                "selection": "B. Robinson anytime TD",
                "model_prob": 0.6336,
                "line": 0.5,
                "player": "Bijan Robinson",
                "team": "ATL",
                "position": "RB",
                "gsis_id": "espn-4430807",
                "game_id": "401873017",
                "side": "home"
              }
            ],
            "model_prob": 0.40252608,
            "break_even_american": 148,
            "n_atd": 2
          }
        ],
        "3": [
          {
            "card_id": "05ee4ee05f35bee1",
            "mode": "all_td",
            "label": "ALL ANYTIME TD",
            "n_legs": 3,
            "legs": [
              {
                "market": "anytime_td",
                "selection": "P. Nacua anytime TD",
                "model_prob": 0.6393,
                "line": 0.5,
                "player": "Puka Nacua",
                "team": "LAR",
                "position": "WR",
                "gsis_id": "espn-4426515",
                "game_id": "401873021",
                "side": "away"
              },
              {
                "market": "anytime_td",
                "selection": "J. Gibbs anytime TD",
                "model_prob": 0.6353,
                "line": 0.5,
                "player": "Jahmyr Gibbs",
                "team": "DET",
                "position": "RB",
                "gsis_id": "espn-4429795",
                "game_id": "401873020",
                "side": "home"
              },
              {
                "market": "anytime_td",
                "selection": "B. Robinson anytime TD",
                "model_prob": 0.6336,
                "line": 0.5,
                "player": "Bijan Robinson",
                "team": "ATL",
                "position": "RB",
                "gsis_id": "espn-4430807",
                "game_id": "401873017",
                "side": "home"
              }
            ],
            "model_prob": 0.25733492,
            "break_even_american": 289,
            "n_atd": 3
          },
          {
            "card_id": "accc82475791f905",
            "mode": "all_td",
            "label": "ALL ANYTIME TD",
            "n_legs": 3,
            "legs": [
              {
                "market": "anytime_td",
                "selection": "P. Nacua anytime TD",
                "model_prob": 0.6393,
                "line": 0.5,
                "player": "Puka Nacua",
                "team": "LAR",
                "position": "WR",
                "gsis_id": "espn-4426515",
                "game_id": "401873021",
                "side": "away"
              },
              {
                "market": "anytime_td",
                "selection": "J. Gibbs anytime TD",
                "model_prob": 0.6353,
                "line": 0.5,
                "player": "Jahmyr Gibbs",
                "team": "DET",
                "position": "RB",
                "gsis_id": "espn-4429795",
                "game_id": "401873020",
                "side": "home"
              },
              {
                "market": "anytime_td",
                "selection": "D. Henry anytime TD",
                "model_prob": 0.575,
                "line": 0.5,
                "player": "Derrick Henry",
                "team": "BAL",
                "position": "RB",
                "gsis_id": "espn-3043078",
                "game_id": "401873012",
                "side": "home"
              }
            ],
            "model_prob": 0.23353469,
            "break_even_american": 328,
            "n_atd": 3
          },
          {
            "card_id": "e46156f79640da7f",
            "mode": "all_td",
            "label": "ALL ANYTIME TD",
            "n_legs": 3,
            "legs": [
              {
                "market": "anytime_td",
                "selection": "P. Nacua anytime TD",
                "model_prob": 0.6393,
                "line": 0.5,
                "player": "Puka Nacua",
                "team": "LAR",
                "position": "WR",
                "gsis_id": "espn-4426515",
                "game_id": "401873021",
                "side": "away"
              },
              {
                "market": "anytime_td",
                "selection": "B. Robinson anytime TD",
                "model_prob": 0.6336,
                "line": 0.5,
                "player": "Bijan Robinson",
                "team": "ATL",
                "position": "RB",
                "gsis_id": "espn-4430807",
                "game_id": "401873017",
                "side": "home"
              },
              {
                "market": "anytime_td",
                "selection": "D. Henry anytime TD",
                "model_prob": 0.575,
                "line": 0.5,
                "player": "Derrick Henry",
                "team": "BAL",
                "position": "RB",
                "gsis_id": "espn-3043078",
                "game_id": "401873012",
                "side": "home"
              }
            ],
            "model_prob": 0.23290978,
            "break_even_american": 329,
            "n_atd": 3
          }
        ],
        "4": [
          {
            "card_id": "a3f8830b2ffc8d61",
            "mode": "all_td",
            "label": "ALL ANYTIME TD",
            "n_legs": 4,
            "legs": [
              {
                "market": "anytime_td",
                "selection": "P. Nacua anytime TD",
                "model_prob": 0.6393,
                "line": 0.5,
                "player": "Puka Nacua",
                "team": "LAR",
                "position": "WR",
                "gsis_id": "espn-4426515",
                "game_id": "401873021",
                "side": "away"
              },
              {
                "market": "anytime_td",
                "selection": "J. Gibbs anytime TD",
                "model_prob": 0.6353,
                "line": 0.5,
                "player": "Jahmyr Gibbs",
                "team": "DET",
                "position": "RB",
                "gsis_id": "espn-4429795",
                "game_id": "401873020",
                "side": "home"
              },
              {
                "market": "anytime_td",
                "selection": "B. Robinson anytime TD",
                "model_prob": 0.6336,
                "line": 0.5,
                "player": "Bijan Robinson",
                "team": "ATL",
                "position": "RB",
                "gsis_id": "espn-4430807",
                "game_id": "401873017",
                "side": "home"
              },
              {
                "market": "anytime_td",
                "selection": "D. Henry anytime TD",
                "model_prob": 0.575,
                "line": 0.5,
                "player": "Derrick Henry",